[
  
  {
    "Name": "Human",
    "SuperRace": "None",
    "Description": "Humans are just ordinary humans for the most part, though many from Terna will bear cybernetic enhancements.",
    "Strength": 0,
    "Dexterity": 0,
    "Constitution": 0,
    "Willpower": 0,
    "Intellect": 0,
    "Charisma": 0,
    "Height": [ 54, 76 ],
    "Weight": [ 125, 300 ],
    "HairColors": [ "Brown", "Black", "Ginger", "Blonde" ],
    "EyeColors": [ "Brown", "Blue", "Green", "Hazel", "Amber", "Gray", "Red", "Violet" ],
    "SkinColors": [ "Brown", "Beige" ]
  },

  {
    "Name": "Red Elf",
    "SuperRace": "Elf",
    "Description": "",
    "Strength": 0,
    "Dexterity": 0,
    "Constitution": 0,
    "Willpower": 0,
    "Intellect": 0,
    "Charisma": 0,
    "Height": [],
    "Weight": [],
    "HairColors": [],
    "EyeColors": [],
    "SkinColors": []
  },

  {
    "Name": "Green Elf",
    "SuperRace": "Elf",
    "Description": "",
    "Strength": 0,
    "Dexterity": 0,
    "Constitution": 0,
    "Willpower": 0,
    "Intellect": 0,
    "Charisma": 0,
    "Height": [],
    "Weight": [],
    "HairColors": [],
    "EyeColors": [],
    "SkinColors": []
  },

  {
    "Name": "White Elf",
    "SuperRace": "Elf",
    "Description": "",
    "Strength": 0,
    "Dexterity": 0,
    "Constitution": 0,
    "Willpower": 0,
    "Intellect": 0,
    "Charisma": 0,
    "Height": [],
    "Weight": [],
    "HairColors": [],
    "EyeColors": [],
    "SkinColors": []
  },

  {
    "Name": "Gray Elf",
    "SuperRace": "Elf",
    "Description": "",
    "Strength": 0,
    "Dexterity": 0,
    "Constitution": 0,
    "Willpower": 0,
    "Intellect": 0,
    "Charisma": 0,
    "Height": [],
    "Weight": [],
    "HairColors": [],
    "EyeColors": [],
    "SkinColors": []
  },

  {
    "Name": "Black-Eyed Orc",
    "SuperRace": "Orc",
    "Description": "",
    "Strength": 0,
    "Dexterity": 0,
    "Constitution": 0,
    "Willpower": 0,
    "Intellect": 0,
    "Charisma": 0,
    "Height": [],
    "Weight": [],
    "HairColors": [],
    "EyeColors": [],
    "SkinColors": []
  },

  {
    "Name": "Yellow-Eyed Orc",
    "SuperRace": "Orc",
    "Description": "",
    "Strength": 0,
    "Dexterity": 0,
    "Constitution": 0,
    "Willpower": 0,
    "Intellect": 0,
    "Charisma": 0,
    "Height": [],
    "Weight": [],
    "HairColors": [],
    "EyeColors": [],
    "SkinColors": []
  },

  {
    "Name": "Dwarf",
    "SuperRace": "None",
    "Description": "",
    "Strength": 0,
    "Dexterity": 0,
    "Constitution": 0,
    "Willpower": 0,
    "Intellect": 0,
    "Charisma": 0,
    "Height": [ 48, 60 ],
    "Weight": [],
    "HairColors": [],
    "EyeColors": [],
    "SkinColors": []
  },

  {
    "Name": "Gnome",
    "SuperRace": "None",
    "Description": "",
    "Strength": 0,
    "Dexterity": 0,
    "Constitution": 0,
    "Willpower": 0,
    "Intellect": 0,
    "Charisma": 0,
    "Height": [],
    "Weight": [],
    "HairColors": [],
    "EyeColors": [],
    "SkinColors": []
  },

  {
    "Name": "Green Shialonian",
    "SuperRace": "Shialonian",
    "Description": "Shialonians are tiny pinky sized people divided into two sub races that despise one another. These are the Green Shialonians, and the Red Shialonians. Both have white hair, pointed ears, and Fey like eyes that are red or green in hue. Green Shialonians have green skin and red eyes. They hate each other for existing and looking different than one another, and wage war because of that fact. The reason being that in their religion, only one of them is the true creation of Shialon, their god. Each side depicts Shialon with their races color, which equally enrages both sides. They mainly reside in the Blood Desert, but their burrows can be found anywhere in the wastes.",
    "Strength": -3,
    "Dexterity": 1,
    "Constitution": 2,
    "Willpower": 1,
    "Intellect": 1,
    "Charisma": -2,
    "Height": [ 4, 5 ],
    "Weight": [ 0.025, 0.075 ],
    "HairColors": [ "White" ],
    "EyeColors": [ "Red" ],
    "SkinColors": [ "Green" ]
  },

  {
    "Name": "Red Shialonian",
    "SuperRace": "Shialonian",
    "Description": "Shialonians are tiny pinky sized people divided into two sub races that despise one another. These are the Green Shialonians, and the Red Shialonians. Both have white hair, pointed ears, and Fey like eyes that are red or green in hue. Red Shialonians have green skin and green eyes. They hate each other for existing and looking different than one another, and wage war because of that fact. The reason being that in their religion, only one of them is the true creation of Shialon, their god. Each side depicts Shialon with their races color, which equally enrages both sides. They mainly reside in the Blood Desert, but their burrows can be found anywhere in the wastes.",
    "Strength": -3,
    "Dexterity": 1,
    "Constitution": 2,
    "Willpower": 1,
    "Intellect": 1,
    "Charisma": -2,
    "Height": [ 4, 5 ],
    "Weight": [ 0.025, 0.075 ],
    "HairColors": [ "White" ],
    "EyeColors": [ "Green" ],
    "SkinColors": [ "Red" ]
  },

  {
    "Name": "Halfling",
    "SuperRace": "None",
    "Description": "",
    "Strength": 0,
    "Dexterity": 0,
    "Constitution": 0,
    "Willpower": 0,
    "Intellect": 0,
    "Charisma": 0,
    "Height": [],
    "Weight": [],
    "HairColors": [],
    "EyeColors": [],
    "SkinColors": []
  }
]